2743,"OMEGA LIMP COMERCIO E SERVIÇOS LTDA","Copa e cozinha","Limpeza e higiene",,,,,,,,,,,,,,,,,,,,,,,,,,,,,,,,,,,,,,,,,,
2744,"L.L.COMÉRCIO DE FERRAMENTAS LTDA","Ferragens e ferramentas",,,,,,,,,,,,,,,,,,,,,,,,,,,,,,,,,,,,,,,,,,,
2745,"PATRICIA RAIA MOVEIS - EPP","Mobiliário",,,,,,,,,,,,,,,,,,,,,,,,,,,,,,,,,,,,,,,,,,,
2746,"ABACOR INDÚSTRIA E COMÉRCIO LTDA.","Material para eventos (sacola, caneta, chaveiro e outros)",,,,,,,,,,,,,,,,,,,,,,,,,,,,,,,,,,,,,,,,,,,
2747,"OMEGATI COMÉRCIO DE INFORMÁTICA LTDA","Audiovisual","Material de escritório e desenho (papelaria)","Informática (acessórios e equipamentos)","Informática (softwares)","Informática (suprimentos)","Serviço gráfico (manutenção de máquinas e equipamentos)",,,,,,,,,,,,,,,,,,,,,,,,,,,,,,,,,,,,,,
2748,"INDUSTRIA GRAFICA BRASILEIRA LTDA","Digitalização de textos","Impressão gráfica","Jornais e revistas","Livros","Material e equipamento gráfico","Papéis e cartões","Serviço gráfico (afiação de faca gráfica)","Serviço gráfico (manutenção de máquinas e equipamentos)",,,,,,,,,,,,,,,,,,,,,,,,,,,,,,,,,,,,
2749,"Livraria  Atlas Ribeirão Ltda","Livros",,,,,,,,,,,,,,,,,,,,,,,,,,,,,,,,,,,,,,,,,,,
2750,"Ivandir Policeno ME","Material e equipamento gráfico","Médico-hospitalar",,,,,,,,,,,,,,,,,,,,,,,,,,,,,,,,,,,,,,,,,,
2751,"SANTO ANDRE LUBRIFICANTES COMERCIO IMPORTACAO E EXPORTACAO LTDA","Combustíveis, gases e lubrificantes",,,,,,,,,,,,,,,,,,,,,,,,,,,,,,,,,,,,,,,,,,,
2752,"Pigma Gráfica e Editora Ltda","Impressão gráfica",,,,,,,,,,,,,,,,,,,,,,,,,,,,,,,,,,,,,,,,,,,
2753,"TOPP TABLE COMERCIO DE UTENSILIOS PARA RESTAURANTE LTDA","Copa e cozinha",,,,,,,,,,,,,,,,,,,,,,,,,,,,,,,,,,,,,,,,,,,
2754,"ECO MAIS COMERCIAL DE MADEIRAS LTDA","Madeiras",,,,,,,,,,,,,,,,,,,,,,,,,,,,,,,,,,,,,,,,,,,
2755,"FONTE ROCHA BRANCA LTDA","Copa e cozinha","Gêneros alimentícios",,,,,,,,,,,,,,,,,,,,,,,,,,,,,,,,,,,,,,,,,,
2756,"J BRILHANTE COMERCIAL LTDA EPP","Copa e cozinha","Gêneros alimentícios","Limpeza e higiene","Material descartável (copo, guardanapo, papel toalha, papel higiênico e outros)","Material para eventos (sacola, caneta, chaveiro e outros)",,,,,,,,,,,,,,,,,,,,,,,,,,,,,,,,,,,,,,,
2757,"Vidraçaria Alto da Lapa Ltda EPP","Vidraçaria",,,,,,,,,,,,,,,,,,,,,,,,,,,,,,,,,,,,,,,,,,,
2758,"Mundial Gráfica LTDA","Comunicação visual (banners, faixas, sinalização e placas de identificação)","Impressão gráfica",,,,,,,,,,,,,,,,,,,,,,,,,,,,,,,,,,,,,,,,,,
2759,"ECO - COMUNICAÇÕES ELETRÔNICAS LTDA ME","Informática (acessórios e equipamentos)","Informática (softwares)","Informática (suprimentos)","Material elétrico","Serviço de áudio e vídeo","Telecomunicações",,,,,,,,,,,,,,,,,,,,,,,,,,,,,,,,,,,,,,
2760,"CORTE RAPIDO COMERCIO DE MADEIRAS LTDA-EPP","Madeiras","Material para construção","Produtos químicos",,,,,,,,,,,,,,,,,,,,,,,,,,,,,,,,,,,,,,,,,
2761,"COMAVE COMERCIO DE MADEIRAS VELASQUES LTDA EPP","Material para construção",,,,,,,,,,,,,,,,,,,,,,,,,,,,,,,,,,,,,,,,,,,
2762,"Affinidade Moveis para Escritorio e Informatica LTDA ME","Mobiliário",,,,,,,,,,,,,,,,,,,,,,,,,,,,,,,,,,,,,,,,,,,
2763,"Adescryn Gráfica Editora Ltda.","Impressão gráfica","Material para eventos (sacola, caneta, chaveiro e outros)",,,,,,,,,,,,,,,,,,,,,,,,,,,,,,,,,,,,,,,,,,
2764,"BRASOFTWARE INFORMATICA LTDA","Cursos e treinamentos","Material e equipamento de laboratório","Informática (softwares)",,,,,,,,,,,,,,,,,,,,,,,,,,,,,,,,,,,,,,,,,
2765,"Thamys Produtos Especiais LTDA EPP","Comunicação visual (banners, faixas, sinalização e placas de identificação)","Encadernação de livros/revistas","Material e equipamento gráfico",,,,,,,,,,,,,,,,,,,,,,,,,,,,,,,,,,,,,,,,,
2766,"FATOR 969 COMERCIAL LTDA ME","Informática (suprimentos)",,,,,,,,,,,,,,,,,,,,,,,,,,,,,,,,,,,,,,,,,,,
2767,"Araxa Comercio e Serviços Ltda - Epp","Madeiras","Material elétrico","Material hidráulico","Material para construção","Material para pintura",,,,,,,,,,,,,,,,,,,,,,,,,,,,,,,,,,,,,,,
3858,"Rita de Cássia Forneiro Jardim-Me","Audiovisual","Organização de eventos e buffet","Serviço de áudio e vídeo","Tradução de textos","Tradução simultânea",,,,,,,,,,,,,,,,,,,,,,,,,,,,,,,,,,,,,,,
2769,"PERSAID COMERCIAL E DISTRIBUIDORA LTDA.","Ferragens e ferramentas","Informática (acessórios e equipamentos)","Informática (suprimentos)","Mobiliário","Obras e serviços na construção civil","Tapeçaria e decoração",,,,,,,,,,,,,,,,,,,,,,,,,,,,,,,,,,,,,,
2770,"COMERCIO DE UTENSILIOS MULTI-USO LTDA","Limpeza e higiene","Material descartável (copo, guardanapo, papel toalha, papel higiênico e outros)",,,,,,,,,,,,,,,,,,,,,,,,,,,,,,,,,,,,,,,,,,
2771,"TANIA DE FÁTIMA GOZZO -ME","Médico-hospitalar","Segurança e proteção","Uniformes",,,,,,,,,,,,,,,,,,,,,,,,,,,,,,,,,,,,,,,,,
2772,"Tintas Famosas Comercio de tintas Ltda","Material para pintura",,,,,,,,,,,,,,,,,,,,,,,,,,,,,,,,,,,,,,,,,,,
2773,"M.M. Sá Comercio e Repres. LTDA","Audiovisual","Copa e cozinha","Eletrodomésticos","Ferragens e ferramentas","Informática (acessórios e equipamentos)","Informática (softwares)","Material elétrico","Material hidráulico","Material para construção","Refrigeração","Segurança e proteção","Telecomunicações",,,,,,,,,,,,,,,,,,,,,,,,,,,,,,,,
2774,"GUIMAR MAGAZINE LTDA","Mobiliário","Tapeçaria e decoração",,,,,,,,,,,,,,,,,,,,,,,,,,,,,,,,,,,,,,,,,,
2775,"JOSÉ AUGUSTO ZABALETA IRIGON","Higienização e restauração de acervo (livros, documentos, slides, microfilmes e outros) ",,,,,,,,,,,,,,,,,,,,,,,,,,,,,,,,,,,,,,,,,,,
2776,"MICROSTART COMÉRCIO DE SUPRIMENTOS PARA INFORMÁTICA LTDA-EPP","Audiovisual","Eletrodomésticos","Informática (acessórios e equipamentos)","Informática (suprimentos)",,,,,,,,,,,,,,,,,,,,,,,,,,,,,,,,,,,,,,,,
2777,"RODITEC RODIZIOS E CARRINHOS INDUSTRIAIS LTDA","Ferragens e ferramentas","Materiais e equipamentos para movimentação de carga",,,,,,,,,,,,,,,,,,,,,,,,,,,,,,,,,,,,,,,,,,
2778,"MARCELO MOURAO ME","Limpeza e higiene","Material descartável (copo, guardanapo, papel toalha, papel higiênico e outros)","Produtos químicos",,,,,,,,,,,,,,,,,,,,,,,,,,,,,,,,,,,,,,,,,
2779,"COMERCIAL DE MADEIRAS RISSO LTDA","Ferragens e ferramentas","Madeiras","Material elétrico","Material hidráulico","Material para construção","Material para pintura",,,,,,,,,,,,,,,,,,,,,,,,,,,,,,,,,,,,,,
2782,"UNIC CENTRAL DISTRIBUIDORA DE MATERIAIS LTDA","Audiovisual","Carimbos","Chaveiro","Comunicação visual (banners, faixas, sinalização e placas de identificação)","Copa e cozinha","Eletrodomésticos","Encadernação de livros/revistas","Material de escritório e desenho (papelaria)","Informática (acessórios e equipamentos)","Informática (suprimentos)","Limpeza e higiene","Livros","Madeiras","Material descartável (copo, guardanapo, papel toalha, papel higiênico e outros)","Material e equipamento gráfico","Mobiliário","Papéis e cartões","Produtos químicos","Refrigeração","Serviço de áudio e vídeo","Tapeçaria e decoração","Telecomunicações","Uniformes","Vidraçaria",,,,,,,,,,,,,,,,,,,,
2783,"Di CONSTAN COMERCIAL LTDA EPP","Equipamentos e produtos para Biblioteca (itens para conservação, restauração, encadernação, detecção magnética e outros)",,,,,,,,,,,,,,,,,,,,,,,,,,,,,,,,,,,,,,,,,,,
2784,"DPS GONÇALVES INDÚSTRIA E COMÉRCIO DE ALIMENTOS LTDA. EPP","Gêneros alimentícios",,,,,,,,,,,,,,,,,,,,,,,,,,,,,,,,,,,,,,,,,,,
2785,"Ulisses Ricardo Pinto","Refrigeração",,,,,,,,,,,,,,,,,,,,,,,,,,,,,,,,,,,,,,,,,,,
2786,"SUPERSET REPROGRAFIA & OFFSET LTDA - EPP","Material e equipamento gráfico","Serviço gráfico (afiação de faca gráfica)",,,,,,,,,,,,,,,,,,,,,,,,,,,,,,,,,,,,,,,,,,
2787,"Maria Isabel Gandolfi Donadi Exp. Imp. - ME","Médico-hospitalar","Mobiliário",,,,,,,,,,,,,,,,,,,,,,,,,,,,,,,,,,,,,,,,,,
2788,"MIXPRO PRODUTOS PARA INFORMATICA LTDA - ME","Audiovisual","Informática (acessórios e equipamentos)","Informática (softwares)","Informática (suprimentos)",,,,,,,,,,,,,,,,,,,,,,,,,,,,,,,,,,,,,,,,
2789,"Bortolini Indústria de Móveis Ltda.","Mobiliário",,,,,,,,,,,,,,,,,,,,,,,,,,,,,,,,,,,,,,,,,,,
2790,"Conquista Comercial de Produtos de Limpeza Ltda - ME","Copa e cozinha","Gêneros alimentícios","Limpeza e higiene","Material descartável (copo, guardanapo, papel toalha, papel higiênico e outros)",,,,,,,,,,,,,,,,,,,,,,,,,,,,,,,,,,,,,,,,
2791,"Damaris Comércio de Móveis e Eletro-Eletrônicos Ltda ME","Eletrodomésticos","Material elétrico","Mobiliário","Refrigeração",,,,,,,,,,,,,,,,,,,,,,,,,,,,,,,,,,,,,,,,
2792,"F.F.Faria Paulilo ME","Mobiliário",,,,,,,,,,,,,,,,,,,,,,,,,,,,,,,,,,,,,,,,,,,
2793,"J.H. GABELLINE MAT.CONST.LTDA","Material para pintura",,,,,,,,,,,,,,,,,,,,,,,,,,,,,,,,,,,,,,,,,,,
2794,"WALDEREZ MAGALI SCHIAVON DE OLIVEIRA-EPP","Mobiliário","Serviço de serralheria","Tapeçaria e decoração","Vidraçaria",,,,,,,,,,,,,,,,,,,,,,,,,,,,,,,,,,,,,,,,
2795,"COMETA MATERIAIS ELÉTRICOS LTDA-EPP","Ferragens e ferramentas","Material elétrico","Material hidráulico",,,,,,,,,,,,,,,,,,,,,,,,,,,,,,,,,,,,,,,,,
2796,"L & T INTERIORES, COMÉRCIO DE MÓVEIS LTDA.","Madeiras","Mobiliário","Obras e serviços na construção civil","Serviço de serralheria","Tapeçaria e decoração",,,,,,,,,,,,,,,,,,,,,,,,,,,,,,,,,,,,,,,
2797,"ETIL COMERCIO DE MATERIAL ELETRICO LTDA","Material elétrico","Segurança e proteção",,,,,,,,,,,,,,,,,,,,,,,,,,,,,,,,,,,,,,,,,,
2798,"NICMA MATERIAIS DE ACABAMENTO LTDA","Material para construção",,,,,,,,,,,,,,,,,,,,,,,,,,,,,,,,,,,,,,,,,,,
2799,"FUNARI E FUNARI INDÚSTRIA DE MÓVEIS DE AÇO LTDA EPP","Mobiliário",,,,,,,,,,,,,,,,,,,,,,,,,,,,,,,,,,,,,,,,,,,
2800,"PAULO SERGIO DEZEN-ME","Carimbos","Chaveiro",,,,,,,,,,,,,,,,,,,,,,,,,,,,,,,,,,,,,,,,,,
2801,"GRÁFICA CART EDITORA LTDA. - ME","Comunicação visual (banners, faixas, sinalização e placas de identificação)","Impressão gráfica","Jornais e revistas","Livros","Papéis e cartões",,,,,,,,,,,,,,,,,,,,,,,,,,,,,,,,,,,,,,,
2802,"Tachinartes Papelaria em Geral Ltda ME","Comunicação visual (banners, faixas, sinalização e placas de identificação)","Impressão gráfica",,,,,,,,,,,,,,,,,,,,,,,,,,,,,,,,,,,,,,,,,,
2804,"Stock Mobile Comércio de Móveis Ltda","Eletrodomésticos","Informática (suprimentos)","Mobiliário","Papéis e cartões",,,,,,,,,,,,,,,,,,,,,,,,,,,,,,,,,,,,,,,,
2805,"ANJU SOLUÇÕES GRAICAS","Chaveiro","Material de escritório e desenho (papelaria)","Impressão gráfica","Informática (acessórios e equipamentos)","Material e equipamento gráfico","Material para eventos (sacola, caneta, chaveiro e outros)","Papéis e cartões","Uniformes",,,,,,,,,,,,,,,,,,,,,,,,,,,,,,,,,,,,
2806,"PREMIER SHOP IMPORTAÇÃO E EXPORTAÇÃO LTDA.","Eletrodomésticos","Material de escritório e desenho (papelaria)","Informática (acessórios e equipamentos)","Material descartável (copo, guardanapo, papel toalha, papel higiênico e outros)","Material para eventos (sacola, caneta, chaveiro e outros)","Papéis e cartões",,,,,,,,,,,,,,,,,,,,,,,,,,,,,,,,,,,,,,
2807,"Lanco Ltda","Mobiliário",,,,,,,,,,,,,,,,,,,,,,,,,,,,,,,,,,,,,,,,,,,
2811,"Artepasta Ind e Com Ltda","Equipamentos e produtos para Biblioteca (itens para conservação, restauração, encadernação, detecção magnética e outros)","Material de escritório e desenho (papelaria)",,,,,,,,,,,,,,,,,,,,,,,,,,,,,,,,,,,,,,,,,,
2812,"Paletrans Equipamentos Ltda","Materiais e equipamentos para movimentação de carga",,,,,,,,,,,,,,,,,,,,,,,,,,,,,,,,,,,,,,,,,,,
2814,"NOZAKI SOLUCOES E TECNOLOGIA LTDA ME","Informática (acessórios e equipamentos)","Informática (softwares)","Informática (suprimentos)",,,,,,,,,,,,,,,,,,,,,,,,,,,,,,,,,,,,,,,,,
2815,"casa nova mercatil de ferragens eletrica e hidraulica ltda.","Material elétrico","Material hidráulico","Material para construção","Material para pintura",,,,,,,,,,,,,,,,,,,,,,,,,,,,,,,,,,,,,,,,
2816,"EQUIFLEX MÓVEIS ESCRITÓRIO LTDA.","Mobiliário",,,,,,,,,,,,,,,,,,,,,,,,,,,,,,,,,,,,,,,,,,,
2817,"CAVIGLIA & CIA. LTDA","Equipamentos e produtos para Biblioteca (itens para conservação, restauração, encadernação, detecção magnética e outros)","Mobiliário",,,,,,,,,,,,,,,,,,,,,,,,,,,,,,,,,,,,,,,,,,
2818,"G HUANG KAE TUNG ME","Material de escritório e desenho (papelaria)","Serviço de áudio e vídeo",,,,,,,,,,,,,,,,,,,,,,,,,,,,,,,,,,,,,,,,,,
2819,"FULL PRIME COMÉRCIO E SERVIÇOS DE INFORMÁTICA LTDA ME","Informática (acessórios e equipamentos)","Informática (softwares)","Informática (suprimentos)",,,,,,,,,,,,,,,,,,,,,,,,,,,,,,,,,,,,,,,,,
2820,"Santaço Indústria de Aço Ltda.","Mobiliário",,,,,,,,,,,,,,,,,,,,,,,,,,,,,,,,,,,,,,,,,,,
2821,"LOBOV CIENTIFICA IMPORTAÇÃO EXPORTAÇÃO COMERCIO DE EQUIPAMENTO PARA LABORATORIOS LTDA","Material e equipamento de laboratório","Médico-hospitalar","Produtos químicos","Refrigeração","Segurança e proteção",,,,,,,,,,,,,,,,,,,,,,,,,,,,,,,,,,,,,,,
2822,"AMARYLLIS PAISAGISMO E JARDINAGEM LTDA","Plantas, mudas e insumos",,,,,,,,,,,,,,,,,,,,,,,,,,,,,,,,,,,,,,,,,,,
2823,"E COMÉRCIO DE MÓVEIS VICTOR LTDA","Mobiliário",,,,,,,,,,,,,,,,,,,,,,,,,,,,,,,,,,,,,,,,,,,
3932,"DIFERENCIAL SUPRIMENTOS E DESCARTAVEIS EIRELI ME","Copa e cozinha","Informática (suprimentos)","Limpeza e higiene","Material descartável (copo, guardanapo, papel toalha, papel higiênico e outros)","Material para eventos (sacola, caneta, chaveiro e outros)","Médico-hospitalar","Papéis e cartões","Segurança e proteção - EPI",,,,,,,,,,,,,,,,,,,,,,,,,,,,,,,,,,,,
2825,"LIVRARIA MEU LIVRINHO COMÉRCIO DE LIVROS LTDA","Livros",,,,,,,,,,,,,,,,,,,,,,,,,,,,,,,,,,,,,,,,,,,
2826,"Ferreira Carvalho - ME","Carimbos","Chaveiro","Comunicação visual (banners, faixas, sinalização e placas de identificação)","Impressão gráfica",,,,,,,,,,,,,,,,,,,,,,,,,,,,,,,,,,,,,,,,
2827,"Jéssica Souza da Mata ME","Carimbos","Chaveiro","Comunicação visual (banners, faixas, sinalização e placas de identificação)","Impressão gráfica",,,,,,,,,,,,,,,,,,,,,,,,,,,,,,,,,,,,,,,,
2828,"Suprimark Brasil Com. de tintas e papéis Ltda","Comunicação visual (banners, faixas, sinalização e placas de identificação)",,,,,,,,,,,,,,,,,,,,,,,,,,,,,,,,,,,,,,,,,,,
2829,"SOMAR COMERCIO E CONTRUÇÕES LTDA","Elevadores","Ferragens e ferramentas","Madeiras","Materiais e equipamentos para movimentação de carga","Material elétrico","Material hidráulico","Material para construção","Material para pintura","Mobiliário","Obras e serviços na construção civil","Serviço de serralheria","Tapeçaria e decoração","Vidraçaria",,,,,,,,,,,,,,,,,,,,,,,,,,,,,,,
2848,"MACPLAST COMÉRCIO DE PLÁSTICOS E ISOLANTES LTDA","Comunicação visual (banners, faixas, sinalização e placas de identificação)","Digitalização de textos","Encadernação de livros/revistas","Equipamentos e produtos para Biblioteca (itens para conservação, restauração, encadernação, detecção magnética e outros)","Impressão gráfica","Papéis e cartões",,,,,,,,,,,,,,,,,,,,,,,,,,,,,,,,,,,,,,
2831,"NEW VISION MANUTENÇÃO E LOCAÇÃO DE PROJETORES LTDA","Audiovisual",,,,,,,,,,,,,,,,,,,,,,,,,,,,,,,,,,,,,,,,,,,
2832,"ANTONINHA XAVIER DOS SANTOS - ME","Uniformes",,,,,,,,,,,,,,,,,,,,,,,,,,,,,,,,,,,,,,,,,,,
2833,"PAJ COM DE PAPEL ART E ARTESANATO LTDA","Material e equipamento de laboratório","Equipamentos e produtos para Biblioteca (itens para conservação, restauração, encadernação, detecção magnética e outros)","Material de escritório e desenho (papelaria)","Higienização e restauração de acervo (livros, documentos, slides, microfilmes e outros) ","Material para pintura","Produtos químicos","Segurança e proteção",,,,,,,,,,,,,,,,,,,,,,,,,,,,,,,,,,,,,
2835,"Board Net Indústria e Comércio de Quadros Eireli - EPP","Comunicação visual (banners, faixas, sinalização e placas de identificação)","Material de escritório e desenho (papelaria)",,,,,,,,,,,,,,,,,,,,,,,,,,,,,,,,,,,,,,,,,,
2836,"SÃO JOÃO ALIMENTOS LTDA","Gêneros alimentícios",,,,,,,,,,,,,,,,,,,,,,,,,,,,,,,,,,,,,,,,,,,
2837,"FLEX MOBILIARIO PARA ESCRITORIO LTDA-ME","Mobiliário",,,,,,,,,,,,,,,,,,,,,,,,,,,,,,,,,,,,,,,,,,,
2838,"Hilda Pires Rossin-ME","Copa e cozinha","Gêneros alimentícios","Material descartável (copo, guardanapo, papel toalha, papel higiênico e outros)",,,,,,,,,,,,,,,,,,,,,,,,,,,,,,,,,,,,,,,,,
2839,"MULTISUPRIMENTOS SUPRIMENTOS E EQUIPAMENTOS PARA ESCRITÓRIO E INFORMÁTICA LTDA","Informática (acessórios e equipamentos)","Informática (softwares)","Informática (suprimentos)",,,,,,,,,,,,,,,,,,,,,,,,,,,,,,,,,,,,,,,,,
2840,"Eletrotécnica Pires LTDA","Material elétrico",,,,,,,,,,,,,,,,,,,,,,,,,,,,,,,,,,,,,,,,,,,
2841,"L. F. SANTOS RIBEIRÃO PRETO - EPP","Material e equipamento de laboratório",,,,,,,,,,,,,,,,,,,,,,,,,,,,,,,,,,,,,,,,,,,
2842,"Editora Daikoku Ltda","Digitalização de textos","Impressão gráfica","Jornais e revistas","Livros","Serviço de áudio e vídeo",,,,,,,,,,,,,,,,,,,,,,,,,,,,,,,,,,,,,,,
2843,"Madegramas Paisagismo Ltda","Plantas, mudas e insumos",,,,,,,,,,,,,,,,,,,,,,,,,,,,,,,,,,,,,,,,,,,
2844,"LED ENCADERNADORA COMÉRCIO E SERVIÇO LTDA ME","Cursos e treinamentos","Encadernação de livros/revistas","Equipamentos e produtos para Biblioteca (itens para conservação, restauração, encadernação, detecção magnética e outros)","Higienização e restauração de acervo (livros, documentos, slides, microfilmes e outros) ","Papéis e cartões",,,,,,,,,,,,,,,,,,,,,,,,,,,,,,,,,,,,,,,
2845,"MARCOS CAMARGO BUENO - ME","Comunicação visual (banners, faixas, sinalização e placas de identificação)",,,,,,,,,,,,,,,,,,,,,,,,,,,,,,,,,,,,,,,,,,,
2849,"VÂNIA TAVARES VIEIRA ME","Carimbos","Eletrodomésticos","Material de escritório e desenho (papelaria)","Impressão gráfica","Informática (acessórios e equipamentos)","Informática (softwares)","Informática (suprimentos)","Jornais e revistas","Material elétrico","Material descartável (copo, guardanapo, papel toalha, papel higiênico e outros)","Material e equipamento gráfico","Material para eventos (sacola, caneta, chaveiro e outros)","Papéis e cartões","Serviço de áudio e vídeo",,,,,,,,,,,,,,,,,,,,,,,,,,,,,,
2847,"MULTI-NOX EQUIP. PARA RESTAURANTES LTDA","Copa e cozinha","Vidraçaria",,,,,,,,,,,,,,,,,,,,,,,,,,,,,,,,,,,,,,,,,,
2850,"VIATRANSFER LOCADORA DE VEÍCULOS LTDA","Transportes",,,,,,,,,,,,,,,,,,,,,,,,,,,,,,,,,,,,,,,,,,,
2851,"Guarutelha Materiais para Construções Ltda-EPP","Material hidráulico","Material para construção","Material para pintura",,,,,,,,,,,,,,,,,,,,,,,,,,,,,,,,,,,,,,,,,
2852,"ELLO ARMAZENAGENS LTDA","Audiovisual","Eletrodomésticos","Informática (acessórios e equipamentos)","Informática (softwares)","Informática (suprimentos)","Refrigeração",,,,,,,,,,,,,,,,,,,,,,,,,,,,,,,,,,,,,,
2853,"VENDASTEC COMÉRCIO DE PRODUTOS HOSPITALARES LTDA-ME","Audiovisual","Material e equipamento de laboratório","Médico-hospitalar","Mobiliário",,,,,,,,,,,,,,,,,,,,,,,,,,,,,,,,,,,,,,,,
2854,"RT DISTRIBUIDORA NACIONAL DE PAPEIS E SUPRIMENOS EIRELI","Informática (suprimentos)","Papéis e cartões",,,,,,,,,,,,,,,,,,,,,,,,,,,,,,,,,,,,,,,,,,
3186,"antonio pereira de moraes serviços me","Mobiliário","Obras e serviços na construção civil","Serviço de marcenaria","Serviço de serralheria",,,,,,,,,,,,,,,,,,,,,,,,,,,,,,,,,,,,,,,,
2857,"Diego Koloszuk Hervelha Moveis EPP","Mobiliário",,,,,,,,,,,,,,,,,,,,,,,,,,,,,,,,,,,,,,,,,,,
2858,"Mobko Industria e Comercio de Moveis EPP","Mobiliário",,,,,,,,,,,,,,,,,,,,,,,,,,,,,,,,,,,,,,,,,,,
2859,"AZS COMERCIAL LTDA ME","Ferragens e ferramentas","Material elétrico","Material hidráulico",,,,,,,,,,,,,,,,,,,,,,,,,,,,,,,,,,,,,,,,,
2860,"TEND INFORMATICA E  SERVIÇOS LTDA","Informática (acessórios e equipamentos)","Informática (softwares)","Informática (suprimentos)","Material de escritório e desenho (papelaria)",,,,,,,,,,,,,,,,,,,,,,,,,,,,,,,,,,,,,,,,
2861,"L&C COMERCIO DE PAPELARIA LTDA EPP","Informática (acessórios e equipamentos)","Limpeza e higiene","Material de escritório e desenho (papelaria)","Material descartável (copo, guardanapo, papel toalha, papel higiênico e outros)",,,,,,,,,,,,,,,,,,,,,,,,,,,,,,,,,,,,,,,,
2862,"PJT EVENTOS E SERVIÇOS LTDA","Audiovisual","Tradução de textos","Tradução simultânea",,,,,,,,,,,,,,,,,,,,,,,,,,,,,,,,,,,,,,,,,
2863,"SUZUPAPER COMERCIO DE PAPELARIA LTDA","Material de escritório e desenho (papelaria)","Material descartável (copo, guardanapo, papel toalha, papel higiênico e outros)",,,,,,,,,,,,,,,,,,,,,,,,,,,,,,,,,,,,,,,,,,
2864,"KOLETA AMBIENTAL LTDA","Transportes",,,,,,,,,,,,,,,,,,,,,,,,,,,,,,,,,,,,,,,,,,,
2866,"ORTOPRATIKA INDUSTRIA E COMERCIO LTDA","Material e equipamento de laboratório","Segurança e proteção",,,,,,,,,,,,,,,,,,,,,,,,,,,,,,,,,,,,,,,,,,
2867,"ARCJ SOLUÇÕES EM TECNOLOGIA DA INFORMAÇÃO LTDA","Audiovisual","Equipamentos e produtos para Biblioteca (itens para conservação, restauração, encadernação, detecção magnética e outros)","Informática (acessórios e equipamentos)","Informática (softwares)","Informática (suprimentos)",,,,,,,,,,,,,,,,,,,,,,,,,,,,,,,,,,,,,,,
2868,"Josemar de Assis Lima","Tapeçaria e decoração",,,,,,,,,,,,,,,,,,,,,,,,,,,,,,,,,,,,,,,,,,,
2869,"Flora Pereira Gonçalves - ME","Livros",,,,,,,,,,,,,,,,,,,,,,,,,,,,,,,,,,,,,,,,,,,
2870,"8com Promoções e Eventos","Comunicação visual (banners, faixas, sinalização e placas de identificação)","Materiais e equipamentos para movimentação de carga","Mobiliário",,,,,,,,,,,,,,,,,,,,,,,,,,,,,,,,,,,,,,,,,
2871,"PRESTOBAT LTDA","Eletrodomésticos","Elevadores","Informática (acessórios e equipamentos)","Materiais e equipamentos para movimentação de carga","Material e equipamento gráfico","Mobiliário","Refrigeração",,,,,,,,,,,,,,,,,,,,,,,,,,,,,,,,,,,,,
2872,"EBSCO BRASIL LTDA.","Jornais e revistas",,,,,,,,,,,,,,,,,,,,,,,,,,,,,,,,,,,,,,,,,,,
2873,"AUREA DAL BÓ TRADUÇÕES LTDA.","Tradução de textos","Tradução simultânea",,,,,,,,,,,,,,,,,,,,,,,,,,,,,,,,,,,,,,,,,,
2874,"MARIO AUGUSTO SILVA PEREIRA EPP","Copa e cozinha","Mobiliário",,,,,,,,,,,,,,,,,,,,,,,,,,,,,,,,,,,,,,,,,,
2875,"flora pereira gonçalves - me","Digitalização de textos","Encadernação de livros/revistas","Livros",,,,,,,,,,,,,,,,,,,,,,,,,,,,,,,,,,,,,,,,,
2876,"Terra Verde Organização de Eventos e Promoções Ltda.","Cursos e treinamentos","Digitalização de textos","Equipamentos e produtos para Biblioteca (itens para conservação, restauração, encadernação, detecção magnética e outros)","Higienização e restauração de acervo (livros, documentos, slides, microfilmes e outros) ",,,,,,,,,,,,,,,,,,,,,,,,,,,,,,,,,,,,,,,,
2877,"ENCADERNADORA SANTO AMARO LTDA EPP","Comunicação visual (banners, faixas, sinalização e placas de identificação)","Encadernação de livros/revistas","Equipamentos e produtos para Biblioteca (itens para conservação, restauração, encadernação, detecção magnética e outros)","Higienização e restauração de acervo (livros, documentos, slides, microfilmes e outros) ","Impressão gráfica","Material e equipamento gráfico","Material para eventos (sacola, caneta, chaveiro e outros)","Papéis e cartões",,,,,,,,,,,,,,,,,,,,,,,,,,,,,,,,,,,,
2878,"Isma Indústria Silveira de Móveis de Aço Ltda.","Mobiliário",,,,,,,,,,,,,,,,,,,,,,,,,,,,,,,,,,,,,,,,,,,
2879,"2 Zoom Vídeo e Produções LTda","Serviço de áudio e vídeo",,,,,,,,,,,,,,,,,,,,,,,,,,,,,,,,,,,,,,,,,,,
2880,"IBEC ENGENHARIA LTDA","Obras e serviços na construção civil","Plantas, mudas e insumos",,,,,,,,,,,,,,,,,,,,,,,,,,,,,,,,,,,,,,,,,,
2881,"Capachos & Capachos Importação e Comércio Ltda.-EPP","Limpeza e higiene","Tapeçaria e decoração",,,,,,,,,,,,,,,,,,,,,,,,,,,,,,,,,,,,,,,,,,
2882,"TECVISUAL COMERCIO E SERVIÇOS","Audiovisual","Informática (acessórios e equipamentos)","Serviço de áudio e vídeo",,,,,,,,,,,,,,,,,,,,,,,,,,,,,,,,,,,,,,,,,
2884,"LORIGRAF LESTE TINTAS ESPECIAIS LTDA","Impressão gráfica","Material e equipamento gráfico","Papéis e cartões","Produtos químicos",,,,,,,,,,,,,,,,,,,,,,,,,,,,,,,,,,,,,,,,
2885,"SÃO FRANCISCO COMERCIAL GARDEN LTDA ME","Madeiras","Obras e serviços na construção civil","Plantas, mudas e insumos",,,,,,,,,,,,,,,,,,,,,,,,,,,,,,,,,,,,,,,,,
2888,"Infotech Systems Comercial e Serviços de Informatica Ltda","Informática (acessórios e equipamentos)","Informática (softwares)","Informática (suprimentos)",,,,,,,,,,,,,,,,,,,,,,,,,,,,,,,,,,,,,,,,,
2889,"Shekinah Materiais para Construção Ltda ME","Ferragens e ferramentas","Madeiras","Material elétrico","Material hidráulico","Material para construção","Material para pintura",,,,,,,,,,,,,,,,,,,,,,,,,,,,,,,,,,,,,,
2890,"Emplaca Automação e Tecnologia Ltda","Comunicação visual (banners, faixas, sinalização e placas de identificação)","Impressão gráfica",,,,,,,,,,,,,,,,,,,,,,,,,,,,,,,,,,,,,,,,,,
2891,"BIGRAPHICS COMERCIO DE PRODUTOS GRÁFICOS LTDA - ME","Impressão gráfica","Material de escritório e desenho (papelaria)","Material descartável (copo, guardanapo, papel toalha, papel higiênico e outros)","Material e equipamento gráfico","Material para eventos (sacola, caneta, chaveiro e outros)","Papéis e cartões","Serviço gráfico (afiação de faca gráfica)","Serviço gráfico (manutenção de máquinas e equipamentos)",,,,,,,,,,,,,,,,,,,,,,,,,,,,,,,,,,,,
2892,"Artplan Indústria e Comércio de Acessórios para Escritório Ltda","Limpeza e higiene","Material e equipamento de laboratório",,,,,,,,,,,,,,,,,,,,,,,,,,,,,,,,,,,,,,,,,,
2893,"Emplaca Serviços Ltda","Comunicação visual (banners, faixas, sinalização e placas de identificação)","Impressão gráfica","Informática (suprimentos)","Papéis e cartões",,,,,,,,,,,,,,,,,,,,,,,,,,,,,,,,,,,,,,,,
2894,"BCE ELETRONICA COMERCIAL LTDA. EPP","Informática (acessórios e equipamentos)","Material elétrico",,,,,,,,,,,,,,,,,,,,,,,,,,,,,,,,,,,,,,,,,,
